date_published,title,detail,news_from,url
"Fri, 16 Oct 2020 22:04:04 +0000","How The Babylon Bee, a Right-Wing Satire Site, Capitalizes on Confusion",President Trump tweeted about one of the site’s stories on Friday. It is unclear whether he knew it was a joke.,Nytimes,https://www.nytimes.com/2020/10/16/technology/babylon-bee.html
"Fri, 16 Oct 2020 03:09:25 +0000",Twitter Changes Course After Republicans Claim ‘Election Interference’,It had blocked an unsubstantiated New York Post article about the Bidens but said late Thursday that it would allow similar content to be shared.,Nytimes,https://www.nytimes.com/2020/10/15/technology/facebook-twitter-republicans-backlash.html
"Sun, 18 Oct 2020 13:43:15 GMT",5 alternatives to the iPhone 12 that cost under $700,"Apple's new iPhone 12 lineup has some strong selling points — 5G connectivity, dual cameras (three on the Pro versions), a powerful processor and a thinner, lighter design than the iPhone 11. ",Cnn,https://www.cnn.com/2020/10/18/tech/iphone-12-cheaper-alternatives/index.html
"Sun, 18 Oct 2020 19:38:02 GMT",The US President is actively working to repeat the atmosphere that culminated in his last election victory,He's gathered the same people. He's attempting a similar schedule. He even believes he's found an equivalent 11th-hour scandal -- and equivalent Russian disinformation questions have followed.,Cnn,https://www.cnn.com/2020/10/18/politics/donald-trump-election-2020-nostalgia/index.html
"Thu, 15 Oct 2020 16:57:48 +0000",Ignore Phone Companies About 5G,The cellular networks might be life-changing in the future. Not today.,Nytimes,https://www.nytimes.com/2020/10/15/technology/ignore-phone-companies-5g.html
"Wed, 14 Oct 2020 19:34:54 +0000",Among Us: You're the Impostor,"YouTubers, influencers and streamers popularized the multiplayer game. Then their fans started playing too.",Nytimes,https://www.nytimes.com/2020/10/14/style/among-us.html
"Sun, 18 Oct 2020 14:37:23 GMT",The latest on the 2020 election ,,Cnn,https://www.cnn.com/politics/live-news/us-election-news-10-18-2020/index.html
"Sun, 18 Oct 2020 16:52:11 GMT",Analysis: Trump continues bizarre appeals to 'suburban women',"If President Donald Trump loses his reelection bid in November, it will be in part because of his fundamental misunderstanding of the beliefs of ""suburban women,"" whom he has tried to win back with a series of bizarre and racist appeals that seem more targeted to a stereotype from the 1950s and 1960s than the American women who actually live in those areas today. ",Cnn,https://www.cnn.com/2020/10/18/politics/donald-trump-women-gretchen-whitmer/index.html
"Wed, 14 Oct 2020 17:23:43 +0000",Trump Overstates W.H.O. Position on Lockdowns,"The health organization said it continued to advocate a “do it all” approach, including shutdowns when necessary.",Nytimes,https://www.nytimes.com/2020/10/14/technology/trump-coronavirus-who-lockdown.html
"Thu, 15 Oct 2020 14:19:20 +0000",Gadgets Were on the Way Out. Then 2020 Happened.,"A brutally unexpected year turned millions of people into gear nerds, whether they liked it or not.",Nytimes,https://www.nytimes.com/2020/10/14/style/gadgets-are-back.html
"Sun, 18 Oct 2020 19:38:25 GMT",Analysis: Why Biden is putting so many red states in play,Poll of the week: A new Quinnipiac University poll of likely Georgia voters finds former Vice President Joe Biden at 51% and President Donald Trump at 44%. ,Cnn,https://www.cnn.com/2020/10/18/politics/biden-red-states-analysis/index.html
"Sun, 18 Oct 2020 18:02:37 GMT",Opinion: America got cheated,"In the pantheon of Greek gods, Dionysus loomed large. He was the god of fertility, the god of wine and, at the springtime festivals held in his name, the deity most closely associated with the birth of theater. ",Cnn,https://www.cnn.com/2020/10/18/opinions/america-got-cheated-opinion-weekly-column-galant/index.html
"Wed, 14 Oct 2020 17:06:58 +0000",Schools Struggle to Secure Computers,"Facing a laptop shortage, some schools have had to jump through hoops to make remote learning work.",Nytimes,https://www.nytimes.com/2020/10/14/technology/schools-remote-learning-computers.html
"Wed, 14 Oct 2020 17:08:10 +0000","Finally, the First Room-Temperature Superconductor","It conveys electricity in the climate of a crisp fall day, but only under pressures comparable to what you’d find closer to Earth’s core.",Nytimes,https://www.nytimes.com/2020/10/14/science/superconductor-room-temperature.html
"Sun, 18 Oct 2020 11:26:55 GMT",Analysis: Trump's rallies make no political sense. Here's why he does them anyway.,"President Donald Trump's bout with coronavirus gave him the chance for a reset on the top 2020 election issue. Characteristically, he has spurned it. ",Cnn,https://www.cnn.com/2020/10/18/politics/2020-campaign-trump-rallies/index.html
"Wed, 14 Oct 2020 10:00:10 +0000",Disinformation on Ballot Boxes and More Are Circulating on Social Media,"The misinformation touches on ballot boxes, the “deep state,” and a conspiracy involving the coronavirus and the vote.",Nytimes,https://www.nytimes.com/2020/10/14/technology/four-election-related-falsehoods.html
"Thu, 15 Oct 2020 04:51:37 +0000",Riled Up: Misinformation Stokes Calls for Violence on Election Day,"Baseless claims are circulating online about a Democrat-led coup, inflaming tensions in an already turbulent election season.",Nytimes,https://www.nytimes.com/2020/10/13/technology/viral-misinformation-violence-election.html
"Tue, 13 Oct 2020 18:40:37 +0000",IPhone 12 Prices in Line With Recent Years,Apple did not markedly increase the cost of its newest devices from last year.,Nytimes,https://www.nytimes.com/2020/10/13/technology/iphone-12-prices-mini-pro.html
"Tue, 13 Oct 2020 18:06:26 +0000",Hello iPhone 12 and iPhone 12 Pro,The newest iPhones have 5G capability and improved design features. But Apple was vague about just how much faster the phones would be.,Nytimes,https://www.nytimes.com/2020/10/13/technology/hello-iphone-12-and-iphone-12-pro.html
"Tue, 13 Oct 2020 17:50:02 +0000","So, Should You Buy a New Phone or Not?",Here are three steps to take to arrive at an answer.,Nytimes,https://www.nytimes.com/2020/10/13/technology/so-should-you-buy-a-new-phone-or-not.html
"Tue, 13 Oct 2020 17:55:05 +0000",Apple Unveils a Smaller HomePod,The company’s smart speaker product has not been as successful as Amazon Echo and Google Home.,Nytimes,https://www.nytimes.com/2020/10/13/technology/apple-unveils-a-smaller-homepod.html
"Tue, 13 Oct 2020 18:12:43 +0000",Google Employees Are Free to Speak Up. Except on Antitrust.,A company operating in the shadow of government regulators has some very particular rules about what workers can say about it.,Nytimes,https://www.nytimes.com/2020/10/13/technology/google-employees-antitrust.html
"Tue, 13 Oct 2020 17:01:18 +0000","Facebook Bans Anti-Vaccination Ads, Clamping Down Again","The social network, which prohibits misinformation related to the coronavirus, has also banned other types of content in recent days.",Nytimes,https://www.nytimes.com/2020/10/13/technology/facebook-bans-anti-vaccination-ads.html
"Tue, 13 Oct 2020 16:55:27 +0000",When to Buy a New Phone. Or Not.,"If you’re wondering if you should buy a new smartphone, ask yourself these questions first.",Nytimes,https://www.nytimes.com/2020/10/13/technology/when-to-buy-a-new-phone.html
"Wed, 14 Oct 2020 10:32:48 +0000",Another ‘Unfounded’ Study on Origins of Virus Spreads Online,"The publication is the second in a series, from a team led by a Chinese scientist, that has been widely discredited by experts.",Nytimes,https://www.nytimes.com/2020/10/13/technology/another-unfounded-study-on-origins-of-virus-spreads-online.html
"Thu, 15 Oct 2020 19:27:24 +0000",The Apple 5G iPhone Explained: What You Need to Know,The newest iPhones are expected to run on next-generation 5G cellular networks. Let’s get real about what that means.,Nytimes,https://www.nytimes.com/2020/10/13/technology/what-you-need-to-know-about-5g-smartphones.html
"Tue, 13 Oct 2020 15:10:53 +0000","No, There Isn’t Evidence That Trump Owes Money to Russia",The president’s financial disclosure report shows his biggest creditors. There is none bigger than Deutsche Bank.,Nytimes,https://www.nytimes.com/2020/10/13/technology/no-there-isnt-evidence-that-trump-owes-money-to-russia.html
"Tue, 13 Oct 2020 13:58:59 +0000",How a 2nd-Grade Class Sent a Science Experiment to Space,“Any school district now that affords football can afford spaceflight.”,Nytimes,https://www.nytimes.com/2020/10/13/science/blue-origin-school-experiment.html
"Tue, 13 Oct 2020 16:34:24 +0000",Blue Origin's New Shepard Rocket Launches a New Line of Business,"Blue Origin’s New Shepard rocket hasn’t flown space tourists yet, but it has found a business niche with NASA and private science experiments.",Nytimes,https://www.nytimes.com/2020/10/13/science/blue-origin-jeff-bezos.html
"Thu, 15 Oct 2020 13:16:51 +0000",July Is the New January: More Companies Delay Return to the Office,"From Ford to Microsoft, white-collar companies are increasingly extending working from home through next summer.",Nytimes,https://www.nytimes.com/2020/10/13/technology/offices-reopening-delay-coronavirus.html
"Tue, 13 Oct 2020 18:30:11 +0000",She Hunts Viral Rumors About Real Viruses,"For Heidi Larson, the founder of the Vaccine Confidence Project, dispelling vaccine hesitancy means building trust — and avoiding the term “anti-vaxxer.”",Nytimes,https://www.nytimes.com/2020/10/13/health/coronavirus-vaccine-hesitancy-larson.html
"Tue, 13 Oct 2020 14:21:46 +0000",Twitter is Showing That People Are Anxious and Depressed,Researchers are looking at online behavior to gauge public mental health. The results aren’t pretty.,Nytimes,https://www.nytimes.com/2020/10/12/style/self-care/social-media-.html
"Mon, 12 Oct 2020 17:45:03 +0000",You Can’t Escape Uber’s Lobbying,Just being a customer now makes people a target for inescapable corporate advocacy.,Nytimes,https://www.nytimes.com/2020/10/12/technology/you-cant-escape-ubers-lobbying.html
"Mon, 12 Oct 2020 16:37:14 +0000",Facebook Bans Content About Holocaust Denial From Its Site,"Mark Zuckerberg, Facebook’s chief executive, once cited Holocaust denial as something he would allow on the social network for free speech reasons.",Nytimes,https://www.nytimes.com/2020/10/12/technology/facebook-bans-holocaust-denial-content.html
"Mon, 12 Oct 2020 12:12:04 +0000","Fearing Cyber Attacks, Microsoft Takes Down a Risk to the Election","Fearing Russian ransomware attacks on the election, the company and U.S. Cyber Command mounted similar pre-emptive strikes. It is not clear how long they may work.",Nytimes,https://www.nytimes.com/2020/10/12/us/politics/election-hacking-microsoft.html
"Mon, 12 Oct 2020 19:48:38 +0000","On Facebook, Misinformation Is More Popular Now Than in 2016","People are engaging more on Facebook with content from outlets that publish falsehoods and distortions, even though the social network has tried limiting misinformation, new research found.",Nytimes,https://www.nytimes.com/2020/10/12/technology/on-facebook-misinformation-is-more-popular-now-than-in-2016.html
"Mon, 12 Oct 2020 16:06:44 +0000",The Digital Divide Starts With a Laptop Shortage,A surge in worldwide demand by educators for low-cost laptops has created shipment delays and pitted desperate schools against one another. Districts with deep pockets often win out.,Nytimes,https://www.nytimes.com/2020/10/12/technology/laptops-schools-digital-divide.html
