date_published,title,detail,news_from,url
"Sun, 18 Oct 2020 09:44:27 GMT",Dutch king cuts short vacation in Greece after criticism,The Netherlands' King Willem-Alexander and his wife cut short a vacation to Greece on Friday after coming under criticism for traveling during the coronavirus pandemic.,Cnn,https://www.cnn.com/2020/10/18/europe/dutch-king-coronavirus-vacation-intl/index.html
"Sun, 18 Oct 2020 10:50:10 EDT",Democrats’ stunning fundraising,"In top Senate races, three Democrats beat the fundraising record set by Beto O’Rourke last cycle, and every Democrat outraised his or her GOP opponent — often by lopsided totals.",Washingtonpost,https://www.washingtonpost.com/politics/2020/10/18/democrats-stunning-fundraising/?utm_source=rss&utm_medium=referral&utm_campaign=wp_politics
"Sun, 18 Oct 2020 10:50:10 EDT",Democrats’ stunning fundraising,"In top Senate races, three Democrats beat the fundraising record set by Beto O’Rourke last cycle, and every Democrat outraised his or her GOP opponent — often by lopsided totals.",Washingtonpost,https://www.washingtonpost.com/politics/2020/10/18/democrats-stunning-fundraising/?utm_source=rss&utm_medium=referral&utm_campaign=wp_politics
"Thu, 15 Oct 2020 08:00:36 +0000",It took a pandemic to make QR codes a global sensation,"China got with the program ages ago. Now that new parts of the world are wising up to the value of QR codes, will they stick?",Qz,https://qz.com/1917661/qr-codes-are-finally-having-their-moment-because-of-covid-19/
"Thu, 15 Oct 2020 04:23:42 +0000","Stuck at home, Indians are spending big bucks on upgrading their kitchens","Flipkart has seen a four-fold increase in the smart kitchen segment, which includes appliances such as kettles, toasters, vacuum cleaners, and water purifiers.",Qz,https://qz.com/india/1916092/stuck-at-home-indians-are-upgrading-their-kitchen-appliances/
"Fri, 16 Oct 2020 13:33:59 GMT",Broadway worker: My career of 15 years vanished overnight,"CNN's Vanessa Yurkevich speaks to Broadway employees who are out of work as a result of the coronavirus pandemic, leaving a devastating impact on theater production. ",Cnn,https://www.cnn.com/videos/business/2020/10/16/broadway-shutdown-coronavirus-pandemic-pkg-yurkevich-newday-vpx.cnn
"Sat, 17 Oct 2020 23:47:40 GMT",This is America's 'rattiest city' for a sixth year in a row,Chicago is the six-time holder of a title that no city wants. ,Cnn,https://www.cnn.com/2020/10/17/us/chicago-rat-city-2020-trnd/index.html
"Sat, 17 Oct 2020 08:00:35 EDT",Originalism in a diverse America: How does Amy Coney Barrett’s judicial philosophy square with who was left out of the Constitution? ,"Amy Coney Barrett's embrace of originalism has some Americans thinking about what the framers intended, and how it applied to them.",Washingtonpost,https://www.washingtonpost.com/politics/2020/10/17/originalism-diverse-america-how-does-amy-coney-barretts-judicial-philosophy-square-with-who-was-left-out-constitution/?utm_source=rss&utm_medium=referral&utm_campaign=wp_politics
"Sat, 17 Oct 2020 07:00:59 EDT",The 5 types of attack ads defining the 2020 congressional elections,"There are several major crises related to health, race and the economy all happening at once. Those are shaping the battles for Congress.",Washingtonpost,https://www.washingtonpost.com/politics/2020/10/17/5-types-attack-ads-defining-2020-congressional-elections/?utm_source=rss&utm_medium=referral&utm_campaign=wp_politics
"Wed, 14 Oct 2020 18:32:50 +0000",Young Nigerian protesters are using social media to dispel misinformation from traditional media,Protesters are sharing videos of their peaceful demonstrations and evidence of police harassment across WhatsApp groups to better inform older Nigerians,Qz,https://qz.com/africa/1917507/nigeria-endsars-protests-use-twitter-whatsapp-to-beat-fake-news/
"Wed, 14 Oct 2020 17:55:36 +0000","Once again, NBC decided to serve Trump’s interests","NBC is airing a town hall with Donald Trump at the same time as ABC's event with Joe Biden, forcing viewers to choose between the two.",Qz,https://qz.com/1917402/nbc-rewards-trump-with-his-own-town-hall-at-the-same-time-as-bidens/
"Sun, 18 Oct 2020 14:49:36 GMT",Covid-19 vaccine company under federal investigation after allegedly misrepresenting its role in government program Operation Warp Speed,"California biotech company Vaxart, which is working on a Covid-19 vaccine, is under federal investigation and is being sued by a number of investors for allegedly exaggerating its involvement in the US government's Operation Warp Speed program for developing Covid-19 vaccines and treatments.",Cnn,https://www.cnn.com/2020/10/18/business/vaxart-sec-investigation/index.html
"Sat, 17 Oct 2020 20:36:46 GMT",Film star Rhonda Fleming has died,"Rhonda Fleming, a film star in the 1940s and 50s known as the ""Queen of Technicolor,"" has died, according to her assistant. She was 97. ",Cnn,https://www.cnn.com/2020/10/17/entertainment/rhonda-fleming-obit-trnd/index.html
"Sun, 18 Oct 2020 09:06:00 EDT","Trailing in the polls and in fundraising, Trump clings to one marker as a sign of success — crowd size",The president has disregarded the pandemic dangers to stage large rallies as a show of strength and an ego boost after months of campaign stumbles.,Washingtonpost,https://www.washingtonpost.com/politics/trump-crowd-size-rallies/2020/10/17/9ec3e098-0fd2-11eb-b1e8-16b59b92b36d_story.html?utm_source=rss&utm_medium=referral&utm_campaign=wp_politics
"Sun, 18 Oct 2020 08:23:00 EDT",Texas is the most intriguing political state in the country this fall,Trump as president has accelerated trends that are weakening the Republican grip on the Lone Star State.,Washingtonpost,https://www.washingtonpost.com/politics/texas-election-demographics-trump/2020/10/17/c952f440-108e-11eb-b1e8-16b59b92b36d_story.html?utm_source=rss&utm_medium=referral&utm_campaign=wp_politics
"Wed, 14 Oct 2020 17:24:25 +0000",Fashion is struggling to rise to the creative challenge of Covid-19,"Rather than try to propose a way forward for fashion in the era of Covid-19, designers mostly carried on with business as usual at Paris Fashion Week.",Qz,https://qz.com/1916944/paris-fashion-week-failed-to-meet-covid-19s-creative-challenge/
"Wed, 14 Oct 2020 16:51:39 +0000",What happens to absentee ballots after you mail them?,The verification and counting of absentee ballots can begin long before Election Day.,Qz,https://qz.com/1916959/how-are-mail-in-ballots-in-the-presidential-election-counted/
"Sat, 17 Oct 2020 19:18:09 GMT",'Diddy' Combs: 'White men like Trump need to be banished',"In an interview with Charlamagne tha God, rapper Sean ""Diddy"" Combs endorsed presidential candidate Joe Biden and said he was helping to launch a new political party, Our Black Party.",Cnn,https://www.cnn.com/videos/politics/2020/10/17/diddy-sean-combs-biden-trump-orig-kj.cnn
"Sun, 18 Oct 2020 12:11:58 GMT",Band played a concert encased in plastic bubbles. So were the fans,"It's unclear whether The Flaming Lips are using jelly -- or vaseline, for that matter -- at their concerts these days. The rock band is, however, trying plastic bubbles.",Cnn,https://www.cnn.com/2020/10/18/entertainment/flaming-lips-bubble-concert-oklahoma-city-covid-trnd/index.html
"Sun, 18 Oct 2020 06:00:00 EDT","Amid fears of Election Day chaos, one county prepares for anxious days after the vote","In Erie County, Pa., a crucial battleground in a critical swing state, the count could take days, and ‘nobody knows how everybody else is going to react, whichever way it goes.’",Washingtonpost,https://www.washingtonpost.com/politics/amid-fears-of-election-day-chaos-one-county-prepares-for-anxious-days-after-the-vote/2020/10/17/c2c9e928-0a60-11eb-a166-dc429b380d10_story.html?utm_source=rss&utm_medium=referral&utm_campaign=wp_politics
"Sat, 17 Oct 2020 23:00:54 EDT","Trump holds back-to-back rallies in Midwest, Biden campaign warns race is neck-and-neck",,Washingtonpost,https://www.washingtonpost.com/elections/2020/10/17/trump-biden-live-updates/?utm_source=rss&utm_medium=referral&utm_campaign=wp_politics
"Wed, 14 Oct 2020 14:29:52 +0000",China’s election to the UN Human Rights Council revealed its shaky global status,"Beijing had the lowest vote total among the 15 countries elected, indicating growing international backlash.",Qz,https://qz.com/1917295/china-elected-to-un-rights-council-but-with-lowest-support-ever/
"Wed, 14 Oct 2020 08:18:13 +0000",Tanishq is only the latest brand to face the ire of India’s easily offended right wing,"The brand, owned by the 100-year-old Tata Group, had to take down the 40-second ad—that showed a Hindu girl married into a Muslim family—under pressure, as #boycottTanishq trended on social media for nearly two days.",Qz,https://qz.com/india/1916964/tanishq-indian-brands-that-faced-right-wing-social-media-boycott/
"Sun, 18 Oct 2020 13:05:29 GMT",Trump coronavirus adviser undermines importance of masks,White House coronavirus task force member Dr. Scott Atlas sought to undermine the importance of face masks on Saturday as coronavirus cases spike across the US. ,Cnn,https://www.cnn.com/2020/10/17/politics/scott-atlas-face-masks-coronavirus/index.html
"Sun, 18 Oct 2020 00:23:22 GMT",What's next for the US-North Korea relationship?,"Following North Korea's unveiling of a huge new missile at a military parade celebrating the 75th anniversary of the Workers' Party, CNN's Paula Hancocks looks at what these developments mean for the US.",Cnn,https://www.cnn.com/videos/world/2020/10/16/north-korea-kim-jong-un-military-parade-missile-hancocks-pkg-intl-ldn-vpx.cnn
"Sat, 17 Oct 2020 20:49:37 EDT","'It needs to stop’: Whitmer condemns rhetoric at Trump rally, chants of ‘lock her up’ ","The chants came a little more than a week after authorities revealed a foiled plot to kidnap Michigan Gov. Gretchen Whitmer (D), allegedly motivated in part by opposition to the pandemic restrictions President Trump has repeatedly criticized.",Washingtonpost,https://www.washingtonpost.com/politics/2020/10/17/trump-whitmer-lock-her-up/?utm_source=rss&utm_medium=referral&utm_campaign=wp_politics
"Sat, 17 Oct 2020 19:48:01 EDT",Trump aides seek to set aside division and plan for final sprint to Election Day,"The president is behind in polls, but Republicans still see a chance for a repeat of his 2016 come-from-behind victory.",Washingtonpost,https://www.washingtonpost.com/politics/trump-aides-seek-to-set-aside-division-and-plan-for-final-sprint-to-election-day/2020/10/17/09f8cf22-0fbf-11eb-8a35-237ef1eb2ef7_story.html?utm_source=rss&utm_medium=referral&utm_campaign=wp_politics
"Wed, 14 Oct 2020 08:00:54 +0000",Can rapid antigen tests fix contact tracing in the US?,"Because antigen tests are cheaper, they could be used more frequently, making it easier to spot exactly when a person becomes infectious.",Qz,https://qz.com/1916587/can-rapid-antigen-tests-fix-contact-tracing-in-the-us/
"Wed, 14 Oct 2020 08:00:01 +0000",Five things individuals can do to fight climate change,Ordinary people can fight climate change—but reducing your greenhouse gas emissions is only the first step.,Qz,https://qz.com/1915134/five-things-individuals-can-do-to-fight-climate-change/
"Sat, 17 Oct 2020 14:42:02 GMT",National elections loom after a brutal year for Bolivia,"It started with allegations of fraud amid contested national elections.  Then came claims of a coup. An incumbent president was exiled, protests paralyzed the country, and an economy that had been a Latin American success story showed serious signs of decline. ",Cnn,https://www.cnn.com/2020/10/17/americas/election-bolivia-intl/index.html
"Sun, 18 Oct 2020 17:48:46 GMT",Evacuations ordered in Colorado and Utah as crews battle new blazes,Blazes roaring through Colorado and Utah have pushed people from their homes and caused damage that officials have not yet been able to assess.,Cnn,https://www.cnn.com/2020/10/18/us/colorado-utah-fires-evacuation/index.html
"Sat, 17 Oct 2020 18:56:40 EDT",How the Sturgis Motorcycle Rally may have spread coronavirus across the Upper Midwest,"Within weeks of the gathering that drew nearly half a million bikers, the Dakotas, along with Wyoming, Minnesota and Montana, were leading the nation in new coronavirus infections per capita.",Washingtonpost,https://www.washingtonpost.com/health/2020/10/17/sturgis-rally-spread/?utm_source=rss&utm_medium=referral&utm_campaign=wp_politics
"Sat, 17 Oct 2020 18:25:43 EDT",Michigan appeals court reinstates Election Day mail-in ballot deadline as early voting surge continues,More than 26 million people had cast ballots nationwide as early voting began Saturday in Massachusetts and Nevada and extended across New Mexico.,Washingtonpost,https://www.washingtonpost.com/politics/voting-2020-election/2020/10/17/857046bc-10a0-11eb-8a35-237ef1eb2ef7_story.html?utm_source=rss&utm_medium=referral&utm_campaign=wp_politics
"Wed, 14 Oct 2020 06:54:56 +0000",Amazon and Flipkart are serving a new India during this year’s festive sales,"From ensuring safety and hygiene to finding the right products that'll sell in these uncertain times and reaching shoppers in remote regions, there's a lot for Flipkart and Amazon to think.",Qz,https://qz.com/india/1916291/why-amazon-and-flipkart-need-to-up-their-game-this-diwali-sale/
"Tue, 13 Oct 2020 21:13:55 +0000",Apple will change the way we charge phones,"Apple changed up the accessories that come with a new iPhone 12, potentially unlocking a charging revolution.",Qz,https://qz.com/1917088/apples-iphone-12-could-revolutionize-the-future-of-charging/
"Sat, 17 Oct 2020 23:10:32 GMT",Women's March focuses on getting voters to the polls,"Demonstrators gathered in Washington, DC, for the second Women's March of the year. Attendees came together to protest President Donald Trump's nomination of Amy Coney Barrett to the Supreme Court and urge women to vote in the upcoming election. CNN's Suzanne Malveaux reports.",Cnn,https://www.cnn.com/videos/politics/2020/10/17/womens-march-washington-malveaux-sot-vpx.cnn
"Sun, 18 Oct 2020 15:01:32 GMT",These companies' workers may never go back to the office,"As the United States prepares for another wave of the coronavirus, some companies are making plans to keep their employees remote for the forseeable future.",Cnn,https://www.cnn.com/2020/10/18/business/virtual-work-offices-pandemic/index.html
"Sat, 17 Oct 2020 14:29:50 EDT","As pandemic surges and economy stalls, Trump fails to live up to dealmaker image in face of partisan gridlock",Attempts to deliver a stimulus package have faltered as the president’s erratic approach to governing and Democrats’ eagerness to press a political advantage have repeatedly clashed.,Washingtonpost,https://www.washingtonpost.com/politics/trump-democrats-coronvirus-economy/2020/10/17/5533bcbe-102c-11eb-8a35-237ef1eb2ef7_story.html?utm_source=rss&utm_medium=referral&utm_campaign=wp_politics
"Sat, 17 Oct 2020 09:38:49 EDT","Sen. Perdue called out for mocking Sen. Kamala Harris’s first name, echoing Trump","“This kind of vile, race-baiting trash talk is what President Trump has unleashed from sitting Republican members in the Senate,” Democrat Jon Ossoff said.",Washingtonpost,https://www.washingtonpost.com/politics/2020/10/16/senator-perdue-kamala-harris/?utm_source=rss&utm_medium=referral&utm_campaign=wp_politics
"Tue, 13 Oct 2020 17:30:05 +0000",Disney is now a streaming company,"The company announced a strategic reorganization that will prioritize its streaming services: Disney+, ESPN+, and Hulu.",Qz,https://qz.com/1916923/recent-changes-at-disney-prioritize-hulu-disney-and-espn/
"Tue, 13 Oct 2020 17:00:28 +0000",Dropbox commits to going “virtual-first” by converting offices to meeting studios,"When Dropbox reopens next summer, its employees will no longer have an office with individual desks, but instead will have access to studios while they continue to work from home.",Qz,https://qz.com/work/1916574/dropbox-goes-virtual-first-by-turning-offices-into-studios/
"Sat, 17 Oct 2020 18:40:52 GMT",How this former QAnon believer escaped the virtual cult,Jitarth Jadeja found QAnon in 2017. The 32-year-old spent two years entrenched in the virtual cult. His biggest regret? Sharing the conspiracy theory with his father.,Cnn,https://www.cnn.com/videos/business/2020/10/16/qanon-reformed-believer-orig.cnn-business
"Sun, 18 Oct 2020 12:18:24 GMT",You can now rent a private AMC theater for just $99 ,A crisp Benjamin Franklin can get you your own private AMC movie theater. ,Cnn,https://www.cnn.com/2020/10/17/business/amc-rental-99-trnd/index.html
"Sat, 17 Oct 2020 08:00:35 EDT",Originalism in a diverse America: How does Amy Coney Barrett’s judicial philosophy square with who was left out of the Constitution? ,"Amy Coney Barrett's embrace of originalism has some Americans thinking about what the framers intended, and how it applied to them.",Washingtonpost,https://www.washingtonpost.com/politics/2020/10/17/originalism-diverse-america-how-does-amy-coney-barretts-judicial-philosophy-square-with-who-was-left-out-constitution/?utm_source=rss&utm_medium=referral&utm_campaign=wp_politics
"Sat, 17 Oct 2020 08:00:00 EDT","One last vote: In Michigan, a terminally ill man’s mission to cast a ballot","After a recurrence of colon cancer, Jim Williams counted the days until early voting began in his state.",Washingtonpost,https://www.washingtonpost.com/politics/one-last-vote/2020/10/16/785419e4-0fd4-11eb-b1e8-16b59b92b36d_story.html?utm_source=rss&utm_medium=referral&utm_campaign=wp_politics
"Tue, 13 Oct 2020 13:41:31 +0000",The business interests behind vaccine trials work against people of color,Covid-19 vaccine trials are struggling to recruit diverse patients as the industry works to undo long-standing exclusionary practices.,Qz,https://qz.com/1916652/covid-19-vaccine-trial-recruitment-works-against-people-of-color/
"Tue, 13 Oct 2020 11:00:17 +0000",What is owed Africa,"Africa lost 12.5 million men, women, and children to the international slave trade. How should its people be compensated?",Qz,https://qz.com/africa/1915182/what-reparations-are-owed-to-africa/
"Sat, 17 Oct 2020 00:15:04 +0000","In Reversal, Twitter Is No Longer Blocking New York Post Article",The latest change underlined how rapidly social media platforms are shifting their positions in the days leading up to the election.,Nytimes,https://www.nytimes.com/2020/10/16/technology/twitter-new-york-post.html
"Fri, 16 Oct 2020 03:46:17 +0000","Facebook and Twitter Dodge a 2016 Repeat, and Ignite a 2020 Firestorm",The companies have said they would do more to stop misinformation and hacked materials from spreading. This is what that effort looks like.,Nytimes,https://www.nytimes.com/2020/10/15/technology/facebook-twitter-nypost-hunter-biden.html
"Sun, 18 Oct 2020 15:54:18 GMT",NASA and Nokia are putting a 4G network on the moon,"If you're unable to get a cell phone signal when you walk your dog around the block, this will really make your blood boil: NASA is putting a 4G network on the moon.",Cnn,https://www.cnn.com/2020/10/18/tech/4g-network-moon-trnd/index.html
"Sun, 18 Oct 2020 12:27:30 GMT","More than 46,000 fans present as New Zealand beats Australia in Bledisloe Cup","A near-capacity 46,049 crowd was present at Eden Park as New Zealand defeated Australia 27-7 in game two of the Bledisloe Cup.",Cnn,https://www.cnn.com/2020/10/18/sport/new-zealand-all-black-australia-bledisloe-cup-spt-intl/index.html
"Sat, 17 Oct 2020 07:00:59 EDT",The 5 types of attack ads defining the 2020 congressional elections,"There are several major crises related to health, race and the economy all happening at once. Those are shaping the battles for Congress.",Washingtonpost,https://www.washingtonpost.com/politics/2020/10/17/5-types-attack-ads-defining-2020-congressional-elections/?utm_source=rss&utm_medium=referral&utm_campaign=wp_politics
"Fri, 16 Oct 2020 22:21:19 EDT",Biden vows more clarity on expanding the Supreme Court is coming soon,The campaign is playing out Friday across several states that President Trump won four years ago but appear competitive in the closing stretch of the race.,Washingtonpost,https://www.washingtonpost.com/elections/2020/10/16/trump-biden-live-updates/?utm_source=rss&utm_medium=referral&utm_campaign=wp_politics
"Sat, 17 Oct 2020 14:58:56 +0000",YouTube Cracks Down on QAnon Conspiracy Theory,YouTube has played a bigger role in moving QAnon from the fringes to the mainstream than most platforms.,Nytimes,https://www.nytimes.com/2020/10/15/technology/youtube-bans-qanon-violence.html
"Fri, 16 Oct 2020 21:48:41 +0000",Brace for Holiday ‘Shipageddon’,"The pandemic and the holidays will make shipping a zoo. Shoppers, listen up.",Nytimes,https://www.nytimes.com/2020/10/16/technology/holiday-shipageddon.html
"Sat, 17 Oct 2020 10:04:59 GMT",A teacher heard a student's grandma slur her words during a virtual lesson. What she did next saved a life,A first-grade teacher at a Michigan elementary school is being hailed as a hero after alerting the school principal that her online student's grandmother was having a stroke.,Cnn,https://www.cnn.com/2020/10/17/us/teacher-saves-grandma-life-stroke-trnd/index.html
"Sat, 17 Oct 2020 15:59:29 GMT",Kenya's Jepchirchir breaks own world record at World Half Marathon Championships,"Peres Jepchirchir broke her own world record in the women's half marathon, crossing the line in one hour, five minutes and 16 seconds to win gold at the World Athletics Half Marathon Championships in Gdynia, Poland.",Cnn,https://www.cnn.com/2020/10/17/sport/peres-jepchirchir-half-marathon-world-record-spt-intl/index.html
"Fri, 16 Oct 2020 19:47:00 EDT",Supreme Court will review Trump plan to exclude undocumented immigrants from calculations for congressional seats,"A lower court blocked the plan, which would have the effect of shifting both political power and federal funds away from urban states with large immigrant populations.",Washingtonpost,https://www.washingtonpost.com/politics/courts_law/supreme-court-census-undocumented-immigrants/2020/10/16/cf8288be-0f51-11eb-8074-0e943a91bf08_story.html?utm_source=rss&utm_medium=referral&utm_campaign=wp_politics
"Fri, 16 Oct 2020 17:33:49 EDT",Trump opposed Obama’s 2012 reelection based on metrics where he now fares even worse,The federal deficit is only the latest.,Washingtonpost,https://www.washingtonpost.com/politics/2020/10/16/trump-opposed-obamas-2012-reelection-based-metrics-where-he-now-fares-even-worse/?utm_source=rss&utm_medium=referral&utm_campaign=wp_politics
"Sun, 18 Oct 2020 20:15:11 +0000","As Local News Dies, a Pay-for-Play Network Rises in Its Place","A nationwide operation of 1,300 local sites publishes coverage that is ordered up by Republican groups and corporate P.R. firms.",Nytimes,https://www.nytimes.com/2020/10/18/technology/timpone-local-news-metric-media.html
"Sun, 18 Oct 2020 19:36:55 +0000","Remote but Inclusive for Years, and Now Showing Other Companies How","Ultranauts has been developing creative ways to hire, manage and motivate a far-flung and diverse work force for seven years.",Nytimes,https://www.nytimes.com/2020/10/18/technology/ultranauts-remote-work.html
"Sat, 17 Oct 2020 21:21:26 GMT",Halloween is going to look very different during the pandemic,"Halloween, a holiday that brings Americans together over a shared love for candy and costumes, will look very different during the pandemic.",Cnn,https://www.cnn.com/2020/10/17/business/halloween-businesses-pandemic/index.html
"Sat, 17 Oct 2020 14:35:21 GMT",Should there be age limits for elected leaders? ,"No matter who wins, America is about to elect its oldest President ever. Many leaders in the House and Senate are in their 70's, even 80's. Is this a problem?",Cnn,https://www.cnn.com/videos/tv/2020/10/17/should-there-be-age-limits-for-elected-leaders.cnn
"Fri, 16 Oct 2020 17:32:12 EDT",Abortion rights group calls for ouster of Sen.Feinstein from top Democratic post on Judiciary Committee,Liberals were particularly irate at Feinstein’s praise of Republicans for their handling of Trump Supreme Court nominee Amy Coney Barrett’s confirmation hearings.,Washingtonpost,https://www.washingtonpost.com/politics/courts_law/senate-feinstein-democrats-supreme-court/2020/10/16/b61ec292-0fed-11eb-b1e8-16b59b92b36d_story.html?utm_source=rss&utm_medium=referral&utm_campaign=wp_politics
"Sun, 18 Oct 2020 15:53:30 +0000",Paleontologists See Stars as Software Bleeps Scientific Terms,"When their annual conference was moved online, they were amused to find seemingly benign words blocked and replaced with asterisks during virtual sessions.",Nytimes,https://www.nytimes.com/2020/10/18/science/paleontology-banned-words-convey.html
"Fri, 16 Oct 2020 23:42:15 +0000",What Went Viral This Week,"Hunter Biden, a “Two and a Half Men” star’s death and Amy Coney Barrett’s empty notepad carried the week on social media.",Nytimes,https://www.nytimes.com/2020/10/16/technology/what-went-viral-this-week.html
"Sun, 18 Oct 2020 15:06:49 GMT",Forget that pumpkin spice flavored latte. That is not pumpkin. These foods are,"If 2020 has turned you into an unexpected expert in making homemade treats, maybe it's time to start pondering the pumpkin.",Cnn,https://www.cnn.com/2020/10/18/health/pumpkin-spice-food-ideas-wellness/index.html
"Sat, 17 Oct 2020 14:35:48 GMT",How did quarantine affect teens?,"Being a teenager is even harder than usual in a pandemic: pulled from school, unable to see friends, cloistered with family. Yet a new study found surprising upsides. ",Cnn,https://www.cnn.com/videos/tv/2020/10/17/how-is-quarantine-affecting-teens.cnn
